[
  {
    "schema_version": "1.0",
    "ts": "2026-01-15T00:01:40Z",
    "actor": {
      "actor_id": "ENG-ZHANG-0091",
      "actor_type": "engineer",
      "display_alias": null
    },
    "actions": [
      {
        "parameter": "temp",
        "from": 50.0,
        "to": 55.0,
        "unit": "degC"
      }
    ],
    "bundled_action": {
      "is_bundle": false,
      "bundle_reason": "single",
      "note": null
    },
    "context": {
      "product": "P1",
      "machine": "M1",
      "regime_label": "R1",
      "steady_segment_ref": null,
      "group_key": null
    },
    "attribution_confounds": [],
    "recommendation_ref": null,
    "ingest_meta": {
      "source": null,
      "ingested_at": null
    }
  },
  {
    "schema_version": "1.0",
    "ts": "2026-01-15T00:04:10Z",
    "actor": {
      "actor_id": "ENG-ZHANG-0091",
      "actor_type": "engineer",
      "display_alias": null
    },
    "actions": [
      {
        "parameter": "press",
        "from": 1.0,
        "to": 1.1,
        "unit": "kPa"
      }
    ],
    "bundled_action": {
      "is_bundle": false,
      "bundle_reason": "single",
      "note": null
    },
    "context": {
      "product": "P1",
      "machine": "M1",
      "regime_label": "R1",
      "steady_segment_ref": null,
      "group_key": null
    },
    "attribution_confounds": [],
    "recommendation_ref": null,
    "ingest_meta": {
      "source": null,
      "ingested_at": null
    }
  },
  {
    "schema_version": "1.0",
    "ts": "2026-01-15T00:06:40Z",
    "actor": {
      "actor_id": "ENG-ZHANG-0091",
      "actor_type": "engineer",
      "display_alias": null
    },
    "actions": [
      {
        "parameter": "feed",
        "from": 2.0,
        "to": 2.2,
        "unit": "t/h"
      }
    ],
    "bundled_action": {
      "is_bundle": false,
      "bundle_reason": "single",
      "note": null
    },
    "context": {
      "product": "P1",
      "machine": "M1",
      "regime_label": "R1",
      "steady_segment_ref": null,
      "group_key": null
    },
    "attribution_confounds": [],
    "recommendation_ref": null,
    "ingest_meta": {
      "source": null,
      "ingested_at": null
    }
  }
]